{
  "id": "a6e1f3a4-7b4f-4d2a-9e6f-0a7b4f3a4b1e",
  "kind": "poi",
  "title": "Historischer Marktplatz",
  "created_at": "2024-01-15T10:00:00Z",
  "updated_at": "2024-01-16T14:30:00Z",
  "created_by_account_id": "b6a35f2c-dfd7-4c68-8b1b-31dd7a50d4f1",
  "summary": "Der zentrale Platz der Altstadt mit historischem Rathaus und Brunnen.",
  "info": "Hier finden regelmäßig **Wochenmärkte** statt.",
  "tags": [
    "geschichte",
    "architektur",
    "sehenswürdigkeit"
  ],
  "address": "Marktplatz 1, 80331 München",
  "location": {
    "lat": 48.137154,
    "lon": 11.576124
  }
}
