[{"id":"00000000-0000-0000-0000-000000000001","kind":"Ort","title":"Marktplatz Hamburg","created_at":"2025-01-01T12:00:00Z","updated_at":"2025-11-01T09:00:00Z","location":{"lon":9.9937,"lat":53.5511}},{"id":"00000000-0000-0000-0000-000000000002","kind":"Initiative","title":"Nachbarschaftshaus","created_at":"2025-01-01T12:00:00Z","updated_at":"2025-11-02T12:15:00Z","location":{"lon":10.0002,"lat":53.5523}},{"id":"00000000-0000-0000-0000-000000000003","kind":"Projekt","title":"Tauschbox Altona","created_at":"2025-01-01T12:00:00Z","updated_at":"2025-10-30T18:45:00Z","location":{"lon":9.9813,"lat":53.5456}},{"id":"00000000-0000-0000-0000-000000000004","kind":"Ort","title":"Gemeinschaftsgarten","created_at":"2025-01-01T12:00:00Z","updated_at":"2025-11-05T10:00:00Z","location":{"lon":10.0184,"lat":53.5631}},{"id":"00000000-0000-0000-0000-000000000005","kind":"Initiative","title":"Reparaturcaf√©","created_at":"2025-01-01T12:00:00Z","updated_at":"2025-11-03T16:20:00Z","location":{"lon":9.9708,"lat":53.5615}}]